id,question,answer
1,What are the symptoms of COVID-19?,Common symptoms include fever, dry cough, and tiredness.
2,How can I prevent high blood pressure?,Maintain a healthy diet, exercise regularly, and reduce salt intake.
3,What causes diabetes?,Diabetes is caused by high blood sugar levels due to insulin issues.
4,How do I treat a common cold?,Rest, fluids, and over-the-counter medications can relieve symptoms.
5,What is the normal blood pressure range?,A normal range is usually around 120/80 mmHg.
